{
  "schemaVersion": 1,
  "petId": "653c0b44fa4d",
  "computedAt": "2026-05-03T14:25:00.329Z",
  "scores": {
    "health": 70,
    "happiness": 60,
    "energy": 95,
    "cleanliness": 70
  },
  "mood": "happy",
  "level": 1,
  "evolutionStage": "egg",
  "statusHeadline": "Healthy and active",
  "signals": {
    "lastCommitDaysAgo": 0,
    "openIssues": 5,
    "stars": 1,
    "isArchived": false
  },
  "source": "action"
}
